{
  "$schema": "https://json-schema.org/draft/2020-12/schema",
  "title": "Demo library: one interest",
  "description": "Demo content only (decision D4): never used as lessons or exam data. One file per interest. Each chat has a casually typed opening question, a reply of at most 60 words, a short title for the sidebar, and a paraphrase of the question for the find-your-chat challenge. Each thread has a continuation reply of at most 80 words with {{chat:N}} slots that the demo fills with the titles of the thread's earlier chats actually present in the bundle.",
  "type": "object",
  "additionalProperties": false,
  "required": ["interest", "label", "threads", "oneOffs"],
  "properties": {
    "interest": {
      "type": "string",
      "enum": ["fitness", "travel", "food", "money", "work", "study", "music", "home", "pets", "tech", "health", "parenting"]
    },
    "label": { "type": "string", "minLength": 3, "maxLength": 24, "description": "Human label, e.g. \"Food and cooking\"." },
    "threads": { "type": "array", "minItems": 3, "maxItems": 3, "items": { "$ref": "#/$defs/thread" } },
    "oneOffs": { "type": "array", "minItems": 6, "maxItems": 6, "items": { "$ref": "#/$defs/chat" } }
  },
  "$defs": {
    "chat": {
      "type": "object",
      "additionalProperties": false,
      "required": ["id", "title", "question", "reply", "paraphrase"],
      "properties": {
        "id": { "type": "string", "pattern": "^[a-z]+-(t[1-3]-c[1-8]|o[1-6])$" },
        "title": { "type": "string", "minLength": 4, "maxLength": 48, "description": "Two to seven words, sentence case, as a chat sidebar would show it." },
        "question": { "type": "string", "minLength": 8, "maxLength": 220, "description": "Catchy, casually typed opening question (lower case and light typos welcome)." },
        "reply": { "type": "string", "minLength": 20, "maxLength": 440, "description": "At most 60 words. General, non-diagnostic for health and money." },
        "paraphrase": { "type": "string", "minLength": 8, "maxLength": 160, "description": "A rewording of the question that shares few words with the title, used in 'Find the chat where you asked about…'." }
      }
    },
    "thread": {
      "type": "object",
      "additionalProperties": false,
      "required": ["id", "topic", "chats", "continuation"],
      "properties": {
        "id": { "type": "string", "pattern": "^[a-z]+-t[1-3]$" },
        "topic": { "type": "string", "minLength": 4, "maxLength": 60, "description": "What the thread is about, e.g. \"Training for a first half marathon\"." },
        "chats": { "type": "array", "minItems": 8, "maxItems": 8, "items": { "$ref": "#/$defs/chat" }, "description": "In the order they were asked, over several months." },
        "continuation": {
          "type": "object",
          "additionalProperties": false,
          "required": ["question", "reply"],
          "properties": {
            "question": { "type": "string", "minLength": 8, "maxLength": 220, "description": "A natural follow-up the visitor taps when they reopen the found chat." },
            "reply": { "type": "string", "minLength": 40, "maxLength": 640, "description": "At most 80 words, counting each slot as two words. Contains two to four slots {{chat:N}} (N = 1..8, the position of an earlier chat in this thread). The demo replaces each slot with that chat's title." }
          }
        }
      }
    }
  }
}
