{
  "interest": "food",
  "label": "Food and cooking",
  "threads": [
    {
      "id": "food-t1",
      "topic": "Learning to bake sourdough bread",
      "chats": [
        {
          "id": "food-t1-c1",
          "title": "Starting a sourdough starter",
          "question": "ok so i want to make a sourdough starter from scratch, is it really just flour and water?? how long does it take",
          "reply": "Yes, just flour and water. Mix equal weights in a jar, leave it loosely covered at room temperature, and each day throw out most of it and feed it fresh flour and water. Around the end of the first week you should see it bubble and roughly double a few hours after feeding. Whole-grain flour gets it going faster.",
          "paraphrase": "how to grow my own bread culture from nothing but flour and water"
        },
        {
          "id": "food-t1-c2",
          "title": "Starter smells like acetone",
          "question": "my starter smells like nail polish remover is it dead",
          "reply": "Not dead, just hungry. That sharp acetone smell is alcohol building up because the yeast ran out of food. Feed it, and if it keeps happening, feed twice a day or use a bit less starter each time so it has more to eat. It should smell pleasantly sour and yeasty again within a couple of feeds.",
          "paraphrase": "when my jar of bubbly flour stuff gave off a sharp chemical whiff and I panicked"
        },
        {
          "id": "food-t1-c3",
          "title": "First loaf came out flat",
          "question": "first loaf came out flat as a dinner plate. tasted fine tho. what did i do wrong",
          "reply": "Flat but tasty usually means it spread instead of rising, so either the dough was too wet to hold itself up, or it over-proofed and the gluten gave out. Try a little less water next time, shape it tightly, and bake it as soon as it passes the poke test. A hot pot with a lid helps it climb.",
          "paraphrase": "the time my bread turned into a pancake and I wanted to know why"
        },
        {
          "id": "food-t1-c4",
          "title": "Knowing when bulk fermentation is done",
          "question": "how do i know when the dough is done bulk fermenting? everyone says 'until doubled' but mine never doubles",
          "reply": "Forget doubling; watch the dough instead. It is ready when the surface is domed and jiggly, there are bubbles along the sides of the container, and it smells faintly sweet and boozy. A straight-sided clear tub with a tape mark makes judging the rise much easier than a round bowl. Warm kitchens finish faster, cold ones slower.",
          "paraphrase": "how to tell if the dough had risen enough before shaping"
        },
        {
          "id": "food-t1-c5",
          "title": "Scoring without tearing the dough",
          "question": "scoring. my blade drags and tears the dough instead of cutting. tips?",
          "reply": "Dragging means the surface is sticky or the blade is dull. Chill the shaped loaf in the fridge so the skin firms up, dust it lightly with rice flour, and use a fresh blade held at a shallow angle. Make one confident swipe about half a centimetre deep rather than sawing. Hesitation is what tears it.",
          "paraphrase": "making clean cuts on top of the loaf before it goes in the oven"
        },
        {
          "id": "food-t1-c6",
          "title": "Gummy dense crumb at the bottom",
          "question": "crumb is super dense and gummy at the bottom but the top looks great?? what gives",
          "reply": "A gummy base usually means the loaf was underbaked or cut too soon. Bake until the crust is deep brown, not golden, and let it cool completely before slicing, which can take a couple of hours. If the bottom is also pale, the oven floor is too cool; preheat your pot longer or move the rack down.",
          "paraphrase": "when the inside of my bread was wet and heavy near the base"
        },
        {
          "id": "food-t1-c7",
          "title": "Fitting sourdough around a work week",
          "question": "i want to bake on a weekday but the schedule is insane. can i do the overnight thing in the fridge",
          "reply": "Absolutely. Mix and do your stretch and folds in the evening, let it bulk ferment on the counter overnight if your kitchen is cool, or for a few hours before bed if it is warm, then shape and refrigerate. It can sit there a day or two, and you bake straight from cold when you get home.",
          "paraphrase": "making the bread timeline survive office days"
        },
        {
          "id": "food-t1-c8",
          "title": "What to bake after plain sourdough",
          "question": "feeling confident now lol. whats a good next bread to try after plain sourdough",
          "reply": "Try a seeded loaf first; the method is identical, you just fold in toasted seeds. After that, focaccia is forgiving and spectacular, and sourdough pizza dough uses the same starter. If you want a challenge, a high-hydration country loaf will teach you dough handling. Baking with some rye or wholewheat changes the flavour a lot too.",
          "paraphrase": "where to go next once the basic loaf stopped scaring me"
        }
      ],
      "continuation": {
        "question": "ok it's been a while and my starter has sat in the fridge untouched for weeks. can i revive it or do i start over?",
        "reply": "You can almost certainly revive it. Pour off any grey liquid, keep a spoonful, and feed it twice a day for three or four days, the same way you did back in {{chat:1}}. If it smells sharp like in {{chat:2}}, that is just hunger. Once it doubles reliably, bake a plain loaf first and lean on what you learned in {{chat:4}} before going back to the fancier breads."
      }
    },
    {
      "id": "food-t2",
      "topic": "Hosting a first dinner party for eight",
      "chats": [
        {
          "id": "food-t2-c1",
          "title": "Planning a first dinner party",
          "question": "i've never hosted a proper dinner party and 8 people are coming in 3 weeks. where do i even start",
          "reply": "Start with the menu, not the shopping. Pick one main you have cooked before and feel calm about, two sides that can sit in the oven, and a dessert you make the day before. Then write a guest list and a timeline backwards from when people arrive. Three weeks is plenty; test the main this weekend.",
          "paraphrase": "where I panicked about eight guests coming over and asked where to begin"
        },
        {
          "id": "food-t2-c2",
          "title": "Menu for mixed dietary needs",
          "question": "one guest is vegetarian and another cant have dairy. do i cook 3 separate meals or what",
          "reply": "One meal, built flexibly. Make the main something naturally dairy-free, like a roast with a herb and olive oil sauce, and cook a generous vegetarian centrepiece such as a stuffed squash or a bean and tomato bake that everyone will want anyway. Keep cheese and butter as optional extras on the table rather than inside the dishes.",
          "paraphrase": "feeding someone who skips meat and someone who skips milk without cooking three dinners"
        },
        {
          "id": "food-t2-c3",
          "title": "What to make ahead the day before",
          "question": "what can i actually make the day before so i'm not cooking while people arrive",
          "reply": "Loads. Soups, stews and braises taste better the next day. Dessert, salad dressings, roasted vegetables for reheating, and anything sauce-based can all be done ahead. Peel and chop everything, then store it in labelled containers. The only things to leave for the day are green salad, fresh bread and whatever needs to be crisp.",
          "paraphrase": "which dishes survive being cooked early and reheated"
        },
        {
          "id": "food-t2-c4",
          "title": "Starter course and portion sizes",
          "question": "do i need a starter course or is that trying too hard. also how much food per person",
          "reply": "A starter is optional; a bowl of something to nibble while people arrive does the same job with less stress. Olives, warm bread, a dip and some toasted nuts are plenty. For the main, plan roughly a palm-sized portion of protein per person plus a fist-sized serving of each side, then add one extra portion for the table.",
          "paraphrase": "whether to bother with a first plate and how much to cook so nobody goes hungry"
        },
        {
          "id": "food-t2-c5",
          "title": "Getting everything hot at the same time",
          "question": "how do i time it so the main and the sides are all hot at once. this is the part that stresses me",
          "reply": "Work backwards from serving time. Most sides can be cooked fully, then held in a low oven loosely covered with foil for half an hour without harm. Let the roast rest under a tea towel while you finish the sides and the gravy. Warm your plates too. If something is late, serve the nibbles and relax; nobody notices.",
          "paraphrase": "the oven juggling so the roast and the veg finished together"
        },
        {
          "id": "food-t2-c6",
          "title": "Impressive but foolproof dessert",
          "question": "dessert that looks impressive but is basically foolproof? i'm not a baker",
          "reply": "A chocolate pot. Melt dark chocolate into hot cream, pour into little glasses, chill, and top with whipped cream and a pinch of salt before serving. It cannot fail and looks like a restaurant made it. A fruit crumble is the other safe bet: assemble it ahead, bake while you eat the main, serve warm with cream.",
          "paraphrase": "a sweet finish that wouldn't fall apart in a non-baker's hands"
        },
        {
          "id": "food-t2-c7",
          "title": "Hour-by-hour timeline for the day",
          "question": "it's tomorrow!! can you write me an hour by hour timeline for the day",